{
  "schemaVersion": 1,
  "baseline": {
    "id": "smartpipe-2.1.2",
    "version": "2.1.2",
    "gitSha": "8e79902d22de714f493582946f7c260462b0895e",
    "source": "published-nuget-baseline",
    "manifest": "eng/baselines/2.1.2/manifest.json"
  },
  "integrationAtLabBootstrap": {
    "id": "sp220-checkpoint-e-through-11",
    "gitSha": "61ceef6bf69aef0a4f79b25384352d238979200f",
    "includedEpics": ["SP220-01", "SP220-02", "SP220-03", "SP220-04", "SP220-05", "SP220-06", "SP220-07", "SP220-08", "SP220-09", "SP220-10", "SP220-11"],
    "authoritativeFullCandidate": false
  },
  "fullCandidate": {
    "id": "smartpipe-2.2.0-sp220-01-12",
    "version": "2.2.0",
    "gitSha": null,
    "status": "blocked-on-sp220-12",
    "requiredEpics": ["SP220-01", "SP220-02", "SP220-03", "SP220-04", "SP220-05", "SP220-06", "SP220-07", "SP220-08", "SP220-09", "SP220-10", "SP220-11", "SP220-12"]
  }
}
